"cod_ficha","cedula","cod_nacionalidad","cod_estado_civil","cod_cargo","cod_ocupacion","cod_estado","cod_ciudad","cod_nivel_academico","cod_t_pantalon","cod_t_camisas","cod_n_zapatos","cod_contracto","cod_n_contracto","cod_region","cod_cliente","cod_ubicacion","cod_turno","n_rotacion","cod_banco","cta_banco","carnet","nombres","apellidos","fec_nacimiento","lugar_nac","sexo","telefono","celular","direccion","correo","experiencia","observacion","fec_carnet","fec_ingreso","fec_profit","fec_contracto","campo01","campo02","campo03","campo04","cod_us_ing","fec_us_ing","cod_us_mod","fec_us_mod","cod_ficha_status","cod_ficha_status_militar","status_militar_obs","servicio_militar"
"000299","4791074","V","S","001","9999","01","08","0005","04","02","08","04","03","02","00123","232","001","2","001","01510084291000295174","S","OMAR JESUS","GONZALEZ RODRIGUEZ","13/6/1954","JUDIBANA PARAGUANA EDO. FALCON","M","1","0416-7364941","V.P LOS GUAYOS II ETAPA, SECTOR 1, VEREDA 22, CASA Nº 1 EDO. CARABOBO","OMAR_GON@HOTMAIL.COM","3AÑOS","10/06/2017, SE ANEXO NRO. DE CELULAR.
EL OFICIAL FUE ROTADO A BTP PARAPARAL EL 28-09-2018","22/9/2017","17/12/2013","17/12/2013","17/12/2013","","","10.180292","-67.9318365","12","17/12/2013","18156266","24/10/2019","A","9999","","F"
"003020","12036271","V","S","001","9999","01","08","0003","05","03","09","04","03","02","00123","232","001","0","001","01510159811000172254","N","ENRIQUE LUIS","FIGUEROA GONZALEZ","31/3/1974","VALENCIA EDO CARABOBO","M","02418380378","0414-8380378","LAS AGUITAS SECTOR 01 VEREDA 12 CASA 15 LOS GUAYOS","enriqueluisfigueroagonzalez@gmail.com","V120362719","RECOMENDADO POR ROBERTO GONZALEZ  PRIMO DE OCTAVIO AGUILARTE TRABAJADOR ACTIVO","0/0/0000","23/10/2018","23/10/2018","23/10/2018","","","10.1681934","-67.9274538","12","23/10/2018","18156266","24/10/2019","A","9999","","F"
"003679","13276792","V","S","001","9999","01","08","0002","04","02","07","04","01","02","00123","232","001","0","13","01160005110202495050","N","NELSON EDUARDO","REQUENA RODRIGUEZ","18/5/1974","VALENCIA","M","04129051211","0412-8499931","SECTOR OASIS CALE SUCRE CASA NRO 45 EL ROBLE MUNICIPIO LOS GUAYOS ","","8 ANOS","QUEDO EN TRAERLOS RIF Y CUENTA
YOIFRT17@GMAILCOM
SOLO TIENE TERCER ANO  RECOMENDADO POR EL CLIENTE BTP NESTOR HERRERA","0/0/0000","11/10/2019","11/10/2019","11/10/2019","","","10.1562428","-67.9118408","22427659","11/10/2019","18156266","24/10/2019","A","9999","F","F"
